{
  "weave": "1",
  "templateId": "half-read-1",
  "subjectId": "scan-2",
  "subjectLabel": "둘째 스캔",
  "facets": {
    "first-premium": {
      "fields": {
        "first-premium": {
          "state": "empty",
          "notes": [{ "kind": "caution", "text": "합계보험료 칸이 도장에 가려 읽지 못했습니다." }]
        }
      }
    },
    "renewal": {
      "fields": {
        "renews": { "state": "empty" },
        "renewal-cycle": { "state": "empty" },
        "payment-period": { "state": "empty" },
        "maturity-age": { "state": "empty" }
      },
      "notes": [{ "kind": "caution", "text": "계약사항 쪽이 아예 빠져 있습니다. 이 제안서는 보장내역만 왔습니다." }]
    },
    "riders": {
      "fields": {
        "rider-list": {
          "state": "filled",
          "value": [
            { "name": "암진단비(유사암제외)", "amount": 20000000 },
            { "name": "유사암진단비", "amount": 4000000 }
          ]
        }
      }
    }
  }
}
