{
  "weave": "1",
  "templateId": "single-proposal-1",
  "subjectId": "proposal-only",
  "subjectLabel": "받은 제안서",
  "facets": {
    "first-premium": {
      "fields": {
        "first-premium": {
          "state": "filled",
          "value": 64300,
          "notes": [
            { "kind": "quote", "text": "합계보험료 64,300원 (보장보험료 58,300원 / 적립보험료 6,000원)" },
            { "kind": "caution", "text": "6,000원은 적립보험료라 보장에 쓰이지 않습니다. 보장에 쓰이는 돈은 58,300원입니다." }
          ]
        }
      }
    },
    "contract-terms": {
      "fields": {
        "payment-period": { "state": "filled", "value": 240, "notes": [{ "kind": "quote", "text": "20년납" }] },
        "maturity-age": {
          "state": "empty",
          "notes": [{ "kind": "note", "text": "종신 보장이라 만기나이가 없습니다." }]
        },
        "entry-age": { "state": "filled", "value": { "min": 15, "max": 70 } },
        "renews": {
          "state": "filled",
          "value": false,
          "notes": [{ "kind": "caution", "text": "주계약은 비갱신형이지만 특약 두 개가 갱신형입니다. 특약 표를 함께 봅니다." }]
        }
      },
      "notes": [{ "kind": "note", "text": "설계안 2쪽 계약사항 표에서 읽었습니다." }]
    },
    "coverage-amounts": {
      "fields": {
        "death": { "state": "filled", "value": 30000000 },
        "cancer": { "state": "filled", "value": 50000000, "notes": [{ "kind": "caution", "text": "유사암은 가입금액의 20%인 1,000만원만 나옵니다." }] }
      }
    },
    "riders": {
      "fields": {
        "rider-list": {
          "state": "filled",
          "value": [
            { "name": "암진단비(유사암제외)", "amount": 50000000, "renews": false },
            { "name": "질병입원일당(1일이상)", "amount": 20000, "renews": true },
            { "name": "질병수술비", "amount": 200000, "renews": true },
            { "name": "상해후유장해(3~100%)", "amount": 100000000, "renews": false }
          ],
          "notes": [{ "kind": "caution", "text": "갱신형 특약 둘의 보험료가 전체의 얼마인지는 설계안에 나뉘어 있지 않습니다." }]
        }
      }
    }
  }
}
